{"$schema":"https://json-schema.org/draft/2020-12/schema","$id":"urn:access-asia:argus:master-registry-record:v0.2.1","title":"ARGUS Master Registry Record v0.2.1","description":"Vendor-neutral ARGUS Master Registry record schema. v0.2.1 adds backward-compatible separation of evidence claim type and claim condition.","type":"object","additionalProperties":false,"required":["schema_version","argus_id","record_type","canonical_name_or_title","status","related_argus_ids","evidence_refs","external_refs","revision","created_at","updated_at","attributes"],"properties":{"schema_version":{"enum":["0.2.0","0.2.1"]},"argus_id":{"type":"string","minLength":3,"maxLength":96,"pattern":"^[A-Za-z0-9][A-Za-z0-9._-]*$"},"record_type":{"enum":["ENTITY","PROJECT","PROCUREMENT","INTELLIGENCE","OPPORTUNITY","SUPPLIER_PRODUCT","KNOWLEDGE"]},"canonical_name_or_title":{"type":"string","minLength":1,"maxLength":500},"status":{"type":"string","minLength":1,"maxLength":80},"aliases":{"type":"array","items":{"type":"string","minLength":1,"maxLength":300},"uniqueItems":true,"default":[]},"related_argus_ids":{"type":"array","items":{"type":"string","minLength":3,"maxLength":96},"uniqueItems":true},"relationships":{"type":"array","items":{"$ref":"#/$defs/relationship"},"default":[]},"evidence_refs":{"type":"array","items":{"$ref":"#/$defs/evidenceRef"}},"external_refs":{"type":"array","items":{"$ref":"#/$defs/externalRef"}},"information_classification":{"type":"string","minLength":1,"maxLength":80},"revision":{"type":"integer","minimum":1},"created_at":{"type":"string","format":"date-time"},"updated_at":{"type":"string","format":"date-time"},"attributes":{"type":"object"},"domain_classification_refs":{"type":"array","items":{"type":"object","additionalProperties":false,"required":["scheme"],"properties":{"scheme":{"type":"string","minLength":1},"code":{"type":["string","null"]},"label":{"type":["string","null"]},"version":{"type":["string","null"]},"source":{"type":["string","null"]},"status":{"type":["string","null"]}}}},"standard_refs":{"type":"array","items":{"type":"object","additionalProperties":false,"required":["identifier"],"properties":{"reference_id":{"type":["string","null"]},"identifier":{"type":"string","minLength":1},"title":{"type":["string","null"]},"edition_or_version":{"type":["string","null"]},"applicability":{"type":["string","null"]},"source":{"type":["string","null"]},"status":{"type":["string","null"]}}}}},"$defs":{"analyticalLabel":{"enum":["FACT","DERIVED","INFERENCE","ASSUMPTION","UNKNOWN","CONFLICT","STALE"]},"evidenceRef":{"type":"object","additionalProperties":false,"required":["source_system"],"properties":{"source_system":{"type":"string","minLength":1,"maxLength":80},"source_id":{"type":"string","minLength":1,"maxLength":500},"source_locator":{"type":"string","minLength":1,"maxLength":2000},"title":{"type":"string","maxLength":500},"as_of":{"type":"string","format":"date"},"analytical_label":{"$ref":"#/$defs/analyticalLabel"},"notes":{"type":"string","maxLength":2000},"claim_type":{"$ref":"#/$defs/claimType"},"claim_condition":{"$ref":"#/$defs/claimCondition"}},"allOf":[{"anyOf":[{"required":["source_id"]},{"required":["source_locator"]}]},{"anyOf":[{"required":["analytical_label"]},{"required":["claim_type","claim_condition"]}]}]},"externalRef":{"type":"object","additionalProperties":false,"required":["system"],"properties":{"system":{"type":"string","minLength":1,"maxLength":80},"external_id":{"type":"string","minLength":1,"maxLength":500},"url":{"type":"string","format":"uri","maxLength":2000},"label":{"type":"string","maxLength":300}},"anyOf":[{"required":["external_id"]},{"required":["url"]}]},"relationship":{"type":"object","additionalProperties":false,"required":["target_argus_id","relation_type"],"properties":{"target_argus_id":{"type":"string","minLength":3,"maxLength":96},"relation_type":{"enum":["oversees","reports_to","implements","operates","uses","finances","contains","procures","requires","consults_for","integrates","supplied_by","awarded_to","derived_from","replaces","upgrades","related_to"]},"evidence_refs":{"type":"array","items":{"$ref":"#/$defs/evidenceRef"},"default":[]}}},"claimType":{"enum":["FACT","DERIVED","INFERENCE","ASSUMPTION","UNKNOWN"]},"claimCondition":{"enum":["CURRENT","STALE","CONFLICT"]}},"allOf":[{"if":{"properties":{"record_type":{"const":"ENTITY"}}},"then":{"properties":{"attributes":{"type":"object","required":["entity_type"],"properties":{"entity_type":{"type":"string","minLength":1},"country_code":{"type":"string","pattern":"^[A-Z]{2}$"},"parent_entity_id":{"type":"string"},"official_website":{"type":"string","format":"uri"},"official_identifier":{"type":"string"}},"additionalProperties":true}}}},{"if":{"properties":{"record_type":{"const":"PROJECT"}}},"then":{"properties":{"attributes":{"type":"object","required":["project_type"],"properties":{"project_type":{"type":"string","minLength":1},"owner_entity_ids":{"type":"array","items":{"type":"string"}},"implementing_entity_ids":{"type":"array","items":{"type":"string"}},"funding_sources":{"type":"array","items":{"type":"string"}},"funding_maturity":{"enum":["F0","F1","F2","F3","F4","F5","F6"]},"value":{"type":"number"},"currency":{"type":"string","minLength":3,"maxLength":3},"start_date":{"type":"string","format":"date"},"end_date":{"type":"string","format":"date"}},"additionalProperties":true}}}},{"if":{"properties":{"record_type":{"const":"PROCUREMENT"}}},"then":{"properties":{"attributes":{"type":"object","required":["procurement_type"],"properties":{"procurement_type":{"type":"string","minLength":1},"official_reference":{"type":"string"},"package_reference":{"type":"string"},"project_id":{"type":"string"},"procuring_entity_id":{"type":"string"},"buyer_entity_id":{"type":"string"},"end_user_entity_ids":{"type":"array","items":{"type":"string"}},"procurement_state":{"type":"string"},"procurement_method":{"type":"string"},"publication_date":{"type":"string","format":"date"},"closing_date":{"type":"string","format":"date"},"estimated_value":{"type":"number"},"currency":{"type":"string","minLength":3,"maxLength":3},"quantity":{}},"additionalProperties":true}}}},{"if":{"properties":{"record_type":{"const":"INTELLIGENCE"}}},"then":{"properties":{"attributes":{"type":"object","required":["maturity"],"properties":{"maturity":{"enum":["I0","I1","I2","I3","I4","I5","I6","I7","I8","I9"]},"funding_maturity":{"enum":["F0","F1","F2","F3","F4","F5","F6"]},"procurement_state":{"type":"string"},"evidence_confidence":{"type":"string"},"commercial_attractiveness":{"type":"string"},"procurement_horizon":{"enum":["0-6m","6-18m","18-36m","3-5y","Unknown"]},"recommendation":{"enum":["MONITOR","INVESTIGATE","PROMOTE_TO_PX","MERGE_EXISTING","HOLD","REJECT"]},"next_action":{"type":"string"},"material_unknowns":{"type":"array","items":{"type":"string"}}},"additionalProperties":true}}}},{"if":{"properties":{"record_type":{"const":"OPPORTUNITY"}}},"then":{"properties":{"argus_id":{"pattern":"^[0-9]{4}_PX[0-9]{4}_[A-Za-z0-9][A-Za-z0-9_-]*$"},"attributes":{"type":"object","required":["short_name","year_identified"],"properties":{"short_name":{"type":"string","minLength":1,"maxLength":80},"year_identified":{"type":"integer","minimum":2000,"maximum":2200},"maturity":{"enum":["I0","I1","I2","I3","I4","I5","I6","I7","I8","I9"]},"primary_entity_id":{"type":"string"},"project_id":{"type":"string"},"procurement_ids":{"type":"array","items":{"type":"string"}},"owner":{"type":"string"},"commercial_status":{"type":"string"},"next_action":{"type":"string"}},"additionalProperties":true}}}},{"if":{"properties":{"record_type":{"const":"SUPPLIER_PRODUCT"}}},"then":{"properties":{"attributes":{"type":"object","required":["subject_type"],"properties":{"subject_type":{"enum":["ORGANIZATION","PRODUCT","SERVICE","CAPABILITY","CONTACT"]},"country_code":{"type":"string","pattern":"^[A-Z]{2}$"},"company_entity_name":{"type":"string"},"manufacturer":{"type":"string"},"model":{"type":"string"},"capabilities":{"type":"array","items":{"type":"string"}},"contact_details":{"type":"object"},"known_relationship_status":{"type":"string"}},"additionalProperties":true}}}},{"if":{"properties":{"record_type":{"const":"KNOWLEDGE"}}},"then":{"properties":{"attributes":{"type":"object","required":["knowledge_type","statement"],"properties":{"knowledge_type":{"enum":["PATTERN","LESSON","HYPOTHESIS","DECISION","INTERPRETATION","SOURCE_QUALITY","TERMINOLOGY","POSTMORTEM"]},"statement":{"type":"string","minLength":1},"analytical_label":{"$ref":"#/$defs/analyticalLabel"},"confidence":{"type":"string"},"review_date":{"type":"string","format":"date"},"supersedes_knowledge_id":{"type":"string"}},"additionalProperties":true}}}}],"document_id":"ARGUS-SCHEMA-REG-001","version":"0.2.1","effective_date":"2026-10-18","status":"CANDIDATE","timestamp":"2026-10-18T00:00:00+06:00","timezone":"Asia/Dhaka","supersedes":"argus-master-registry-v0.2.0.json"}
