{
  "schema_version": "0.2.1",
  "argus_id": "ENT-BD-MOHA",
  "record_type": "ENTITY",
  "canonical_name_or_title": "Ministry of Home Affairs",
  "status": "current_verified",
  "aliases": [],
  "related_argus_ids": ["ENT-BD-COAST-GUARD"],
  "relationships": [],
  "evidence_refs": [
    {
      "source_system": "BPPA",
      "source_id": "44.08.2680.033.02.106.26.160",
      "source_locator": "https://bppa.gov.bd/advertisement-works/details-98162.html",
      "title": "BCG Coastal Patrol Vessel procurement notice",
      "as_of": "2026-10-18",
      "claim_type": "FACT",
      "claim_condition": "CURRENT",
      "notes": "Official BPPA notice identifies Ministry of Home Affairs as the ministry/division for this procurement."
    }
  ],
  "external_refs": [],
  "information_classification": "internal",
  "revision": 1,
  "created_at": "2026-10-18T00:00:00+06:00",
  "updated_at": "2026-10-18T00:00:00+06:00",
  "attributes": {
    "entity_type": "ministry",
    "country_code": "BD"
  }
}
