{
  "schema_version": "0.2.1",
  "argus_id": "ENT-BD-BCG-PD-224392800",
  "record_type": "ENTITY",
  "canonical_name_or_title": "Project Director — BCG Replacement Vessel Project 224392800",
  "status": "current_verified",
  "aliases": ["Project Director"],
  "related_argus_ids": [
    "ENT-BD-COAST-GUARD",
    "PRJ-BCG-CPV-WD2",
    "PROC-BCG-LT001"
  ],
  "relationships": [
    {
      "target_argus_id": "ENT-BD-COAST-GUARD",
      "relation_type": "reports_to",
      "evidence_refs": []
    }
  ],
  "evidence_refs": [
    {
      "source_system": "BPPA",
      "source_id": "44.08.2680.033.02.106.26.160",
      "source_locator": "https://bppa.gov.bd/advertisement-works/details-98162.html",
      "title": "BCG Coastal Patrol Vessel procurement notice",
      "as_of": "2026-10-18",
      "claim_type": "FACT",
      "claim_condition": "CURRENT",
      "notes": "Official BPPA notice identifies Procuring Entity Name as Project Director and Procuring Entity Code as 224392800 for the CPV procurement."
    }
  ],
  "external_refs": [
    {
      "system": "BPPA_PE_CODE",
      "external_id": "224392800",
      "label": "Procuring Entity Code"
    }
  ],
  "information_classification": "internal",
  "revision": 1,
  "created_at": "2026-10-18T00:00:00+06:00",
  "updated_at": "2026-10-18T00:00:00+06:00",
  "attributes": {
    "entity_type": "procuring_entity_project_office",
    "country_code": "BD",
    "parent_entity_id": "ENT-BD-COAST-GUARD",
    "official_identifier": "224392800",
    "project_id": "PRJ-BCG-CPV-WD2"
  }
}
