{
  "schema_version": "0.2.1",
  "argus_id": "ENT-BD-COAST-GUARD",
  "record_type": "ENTITY",
  "canonical_name_or_title": "Bangladesh Coast Guard Force",
  "status": "current_verified",
  "aliases": ["Bangladesh Coast Guard"],
  "related_argus_ids": [
    "ENT-BD-MOHA",
    "ENT-BD-BCG-PD-224392800",
    "PRJ-BCG-CPV-WD2",
    "PROC-BCG-LT001"
  ],
  "relationships": [
    {
      "target_argus_id": "ENT-BD-MOHA",
      "relation_type": "reports_to",
      "evidence_refs": []
    }
  ],
  "evidence_refs": [
    {
      "source_system": "BPPA",
      "source_id": "44.08.2680.033.02.106.26.160",
      "source_locator": "https://bppa.gov.bd/advertisement-works/details-98162.html",
      "title": "BCG Coastal Patrol Vessel procurement notice",
      "as_of": "2026-10-18",
      "claim_type": "FACT",
      "claim_condition": "CURRENT",
      "notes": "Official BPPA notice identifies Bangladesh Coast Guard Force as the agency under Ministry of Home Affairs."
    }
  ],
  "external_refs": [
    {
      "system": "DTIF_DB001",
      "external_id": "Buyer_Procuring_Entity:Bangladesh Coast Guard",
      "label": "Legacy entity reference"
    }
  ],
  "information_classification": "internal",
  "revision": 2,
  "created_at": "2026-10-16T01:48:17+06:00",
  "updated_at": "2026-10-18T00:00:00+06:00",
  "attributes": {
    "entity_type": "government_agency_end_user",
    "country_code": "BD",
    "parent_entity_id": "ENT-BD-MOHA"
  }
}
